{
  "schema_version": "1.0",
  "id": "architecture/authentication",
  "title": "Authentication architecture",
  "status": "active",
  "authority": "canonical",
  "owner": "platform",
  "version": "2.1",
  "visibility": "internal",
  "scope": "architecture/authentication",
  "supersedes": [
    "architecture/authentication@1.0",
    "decisions/session-storage"
  ],
  "review_after": "2027-02-01",
  "tags": ["architecture", "security"]
}
